[
    {
        "idx": 1,
        "name": "强效金创药",
        "stdmode": 2,
        "hp": 90,
        "looks": 28,
        "duraMax": 5000
    },
    {
        "idx": 2,
        "name": "强效魔法药",
        "stdmode": 2,
        "mp": 180,
        "looks": 29,
        "duraMax": 5000
    },
    {
        "idx": 3,
        "name": "超级红药",
        "stdmode": 2,
        "hp": 130,
        "looks": 813,
        "duraMax": 5000
    },
    {
        "idx": 4,
        "name": "超级蓝药",
        "stdmode": 2,
        "mp": 200,
        "looks": 814,
        "duraMax": 5000
    },
    {
        "idx": 5,
        "name": "强效太阳水",
        "stdmode": 2,
        "hp": 50,
        "mp": 80,
        "looks": 312,
        "duraMax": 5000
    },
    {
        "idx": 6,
        "name": "万年雪霜",
        "stdmode": 2,
        "hp": 100,
        "mp": 160,
        "looks": 260,
        "duraMax": 5000
    },
    {
        "idx": 7,
        "name": "疗伤药",
        "stdmode": 2,
        "hp": 250,
        "mp": 380,
        "looks": 14,
        "duraMax": 5000
    },
    {
        "idx": 8,
        "name": "滋补鸡汤",
        "stdmode": 2,
        "hp": 500,
        "mp": 750,
        "looks": 794,
        "duraMax": 5000
    }
]